id,key,udi,name,title,orderID,hidden,published,hasPublishedVersion,createDate,updateDate,urls,statsEntryCount,statsPlayCount,statsNonPlayCount,firstStatAt,lastStatAt,videoID,videoStatus,videoThumbnailURL,videoDownloadURL,thumbnail,year,length,rentalPrice,purchasePrice,tags,description
42576,ac0b2b53-2c8b-4844-ac82-63c73491aabe,umb://document/ac0b2b532c8b4844ac8263c73491aabe,Guide til parforhold,Guide til parforhold,0,false,true,true,2021-04-10 10:57:42,2024-01-15 22:58:24,/jacob-tingleff/shows/guide-til-parforhold/,6,0,6,2021-06-05 08:57:02,2025-05-15 18:46:14,c0284911134b20bdc7cc2ebf0616060d,ready,https://videodelivery.net/c0284911134b20bdc7cc2ebf0616060d/thumbnails/thumbnail.jpg,https://videodelivery.net/c0284911134b20bdc7cc2ebf0616060d/downloads/default.mp4,"{""focalPoint"":{""left"":0.5,""top"":0.5},""src"":""/media/3147/jacob-tingleff_guide-til-parforhold_400x600.jpg"",""crops"":[{""alias"":""Wide"",""width"":1920,""height"":1080},{""alias"":""High"",""width"":650,""height"":920}]}",2012,48,29,39,"Guide til parforhold,Comedy,Stand-up,Jacob Tingleff","<h2>Stream Jacob Tingleffs Guide til Parforhold - lej eller køb online</h2>
Jacob Tingleff beviser endnu engang sit talent som komiker og manuskriptforfatter, når han sætter pen på problemerne i parforholdet og får dem vredet, så de kommer ud som ren komik med stof til eftertanke.

“Jacob Tingleffs Guide til Parforhold” tager udgangspunkt i parforholdets syv stadier og slår ned på de udfordringer, der opstår undervejs - magtkampe, kønsrollekonflikter, utroskab, skilsmissetanker osv. for at besvare det endegyldige spørgsmål: Hvem er de par, der når til stadie syv?... Er de virkelig lykkelige? Og i givet fald hvordan?

Glæd dig til et show med meninger og jokes flettet sammen til intelligente pointer, der går rent ind hos både mænd og kvinder."
42577,033f1cd4-e29c-48cc-94c9-5869904de021,umb://document/033f1cd4e29c48cc94c95869904de021,"Tingleff, Tingleff Eller Tingleff","Tingleff, Tingleff Eller Tingleff",1,false,true,true,2021-04-10 11:22:22,2024-01-15 22:58:46,/jacob-tingleff/shows/tingleff-tingleff-eller-tingleff/,4,0,4,2021-06-05 09:04:18,2025-04-27 21:35:43,37fb9216e3c24faebce8aa1189305ed1,ready,https://videodelivery.net/37fb9216e3c24faebce8aa1189305ed1/thumbnails/thumbnail.jpg,https://videodelivery.net/37fb9216e3c24faebce8aa1189305ed1/downloads/default.mp4,"{""focalPoint"":{""left"":0.5,""top"":0.5},""src"":""/media/3148/tingleffx3-5.jpg"",""crops"":[{""alias"":""Wide"",""width"":1920,""height"":1080},{""alias"":""High"",""width"":650,""height"":920}]}",2008,120,29,39,"Tingleff Eller Tingleff,Comedy,Stand-up,Jacob Tingleff","<h2>Stream Jacob Tingleffs Tingleff, Tingleff eller Tingleff - lej eller køb online</h2>
“Tingleff, Tingleff eller Tingleff” er showet, hvor en af Danmarks skarpeste stand-up komikere kombinerer jokes, storytelling og storskærm til en veldrejet historie med udgangspunkt i livets mange valg og det eviggyldige spørgsmål: ”Hvad nu hvis?”
Hvad nu hvis den unge Tingleff aldrig havde forladt fødebyen Kollund, men i stedet giftet sig med ungdomskæresten og fået et rigtigt job? Var han så blevet mere lykkelig? Eller det modsatte? Hvordan ville tilværelsen se ud, hvis der var blevet truffet andre valg undervejs?
Med vanligt vovemod fantaserer Tingleff sig ud ad de veje, han aldrig fik gået, både hvad livsstil, parforhold og politisk overbevisning angår. På den måde møder publikum i alt tre Tingleff’er – virkelighedens Tingleff, samt to der aldrig blev, men som kunne have været.
Det er hylende morsomt, men også sært poetisk, når showet elegant fletter fra stand-up scenens hurtige pointer til storskærmssketches med fornemt gæstespil af bl.a. Frank Hvam og Jonatan Spang.
Showet “Tingleff, Tingleff eller Tingleff” spillede for fulde huse i København og på spillesteder landet over i foråret 2008."
43317,4370b5f9-3cd6-403b-9948-21ec7fe59f84,umb://document/4370b5f93cd6403b994821ec7fe59f84,Farvelagte-frustrationer,Farvelagte-frustrationer,2,false,true,true,2021-04-18 09:20:26,2021-04-18 09:21:52,/jacob-tingleff/shows/farvelagte-frustrationer/,0,0,0,,,,,,,/media/3240/farvelagte-frustrationer.jpeg,0,0,,39,,Tekst
